{
  "id": "inceptionresnetv2",
  "name": "InceptionResNetV2",
  "fullName": "Inception-v4, Inception-ResNet and the Impact of Residual Connections on Learning",
  "paperYear": 2016,
  "authors": [
    "Christian Szegedy",
    "Sergey Ioffe",
    "Vincent Vanhoucke",
    "Alex Alemi"
  ],
  "paperUrl": "https://arxiv.org/abs/1602.07261",
  "depth": 164,
  "totalParameters": 55873736,
  "totalFLOPs": 13100000000,
  "inputShape": {
    "channels": 3,
    "height": 299,
    "width": 299
  },
  "top1Accuracy": 0.803,
  "top5Accuracy": 0.953,
  "memoryUsage": 215,
  "description": "InceptionResNetV2 merges parallel multi-branch Inception blocks with ResNet residual sum operations, optimizing training stability and visual extraction capabilities.",
  "colorTheme": "#D97706",
  "tags": [
    "CNN",
    "Classification",
    "Inception",
    "Residual",
    "ImageNet"
  ],
  "architecture": {
    "layers": [
      {
        "id": "input_1",
        "type": "input",
        "name": "input_1",
        "inputShape": {
          "dimensions": [
            null,
            299,
            299,
            3
          ],
          "description": "299\u00d7299\u00d73 RGB Image"
        },
        "outputShape": {
          "dimensions": [
            null,
            299,
            299,
            3
          ],
          "description": "299\u00d7299\u00d73 RGB Image"
        },
        "config": {
          "shape": [
            299,
            299,
            3
          ]
        },
        "parameters": {
          "total": 0,
          "weights": 0,
          "biases": 0,
          "formula": "None",
          "calculationSteps": []
        },
        "educationalNote": {
          "summary": "Input layer receiving normalized RGB pixel matrices.",
          "detailed": "Standard size of 299x299.",
          "whyItMatters": "Sets boundaries.",
          "keyTakeaway": "Sets image boundaries."
        },
        "position": {
          "x": 250,
          "y": 0
        },
        "color": "emerald",
        "icon": "image"
      },
      {
        "id": "conv2d_1_conv",
        "type": "conv2d",
        "name": "conv2d_1_conv",
        "inputShape": {
          "dimensions": [
            null,
            null,
            null,
            3
          ],
          "description": "\u00d73"
        },
        "outputShape": {
          "dimensions": [
            null,
            null,
            null,
            32
          ],
          "description": "\u00d732"
        },
        "config": {
          "filters": 32,
          "kernelSize": [
            3,
            3
          ],
          "strides": [
            2,
            2
          ],
          "padding": "valid",
          "useBias": false,
          "activation": "linear"
        },
        "parameters": {
          "total": 864,
          "weights": 864,
          "biases": 0,
          "formula": "kernel_height \u00d7 kernel_width \u00d7 input_channels \u00d7 output_filters",
          "calculationSteps": [
            {
              "label": "Weights",
              "expression": "3 \u00d7 3 \u00d7 3 \u00d7 32",
              "result": 864,
              "explanation": "Kernel weights."
            }
          ]
        },
        "educationalNote": {
          "summary": "Standard 3x3 convolution.",
          "detailed": "Slides 32 filters across input features.",
          "whyItMatters": "Key feature extraction layer.",
          "keyTakeaway": "Extracts features."
        },
        "position": {
          "x": 250,
          "y": 150
        },
        "color": "blue",
        "icon": "layers"
      },
      {
        "id": "conv2d_1_bn",
        "type": "batch_norm",
        "name": "conv2d_1_bn",
        "inputShape": {
          "dimensions": [
            null,
            null,
            null,
            32
          ],
          "description": "\u00d732"
        },
        "outputShape": {
          "dimensions": [
            null,
            null,
            null,
            32
          ],
          "description": "\u00d732"
        },
        "config": {
          "axis": 3,
          "momentum": 0.99,
          "epsilon": 0.001
        },
        "parameters": {
          "total": 128,
          "weights": 64,
          "biases": 64,
          "formula": "4 \u00d7 channels",
          "calculationSteps": []
        },
        "educationalNote": {
          "summary": "Batch Normalization.",
          "detailed": "Normalizes features.",
          "whyItMatters": "Stabilizes learning.",
          "keyTakeaway": "Keeps channels balanced."
        },
        "position": {
          "x": 250,
          "y": 200
        },
        "color": "gray",
        "icon": "activity"
      },
      {
        "id": "conv2d_1_act",
        "type": "activation",
        "name": "conv2d_1_act",
        "inputShape": {
          "dimensions": [
            null,
            null,
            null,
            32
          ],
          "description": "\u00d732"
        },
        "outputShape": {
          "dimensions": [
            null,
            null,
            null,
            32
          ],
          "description": "\u00d732"
        },
        "config": {
          "activation": "relu"
        },
        "parameters": {
          "total": 0,
          "weights": 0,
          "biases": 0,
          "formula": "None",
          "calculationSteps": []
        },
        "educationalNote": {
          "summary": "Applies relu activation.",
          "detailed": "Non-linear mapping.",
          "whyItMatters": "Permits learning complex representations.",
          "keyTakeaway": "Introduces non-linearity."
        },
        "position": {
          "x": 250,
          "y": 250
        },
        "color": "pink",
        "icon": "zap"
      },
      {
        "id": "conv2d_2_conv",
        "type": "conv2d",
        "name": "conv2d_2_conv",
        "inputShape": {
          "dimensions": [
            null,
            null,
            null,
            32
          ],
          "description": "\u00d732"
        },
        "outputShape": {
          "dimensions": [
            null,
            null,
            null,
            32
          ],
          "description": "\u00d732"
        },
        "config": {
          "filters": 32,
          "kernelSize": [
            3,
            3
          ],
          "strides": [
            1,
            1
          ],
          "padding": "valid",
          "useBias": false,
          "activation": "linear"
        },
        "parameters": {
          "total": 9216,
          "weights": 9216,
          "biases": 0,
          "formula": "kernel_height \u00d7 kernel_width \u00d7 input_channels \u00d7 output_filters",
          "calculationSteps": [
            {
              "label": "Weights",
              "expression": "3 \u00d7 3 \u00d7 32 \u00d7 32",
              "result": 9216,
              "explanation": "Kernel weights."
            }
          ]
        },
        "educationalNote": {
          "summary": "Standard 3x3 convolution.",
          "detailed": "Slides 32 filters across input features.",
          "whyItMatters": "Key feature extraction layer.",
          "keyTakeaway": "Extracts features."
        },
        "position": {
          "x": 250,
          "y": 350
        },
        "color": "blue",
        "icon": "layers"
      },
      {
        "id": "conv2d_2_bn",
        "type": "batch_norm",
        "name": "conv2d_2_bn",
        "inputShape": {
          "dimensions": [
            null,
            null,
            null,
            32
          ],
          "description": "\u00d732"
        },
        "outputShape": {
          "dimensions": [
            null,
            null,
            null,
            32
          ],
          "description": "\u00d732"
        },
        "config": {
          "axis": 3,
          "momentum": 0.99,
          "epsilon": 0.001
        },
        "parameters": {
          "total": 128,
          "weights": 64,
          "biases": 64,
          "formula": "4 \u00d7 channels",
          "calculationSteps": []
        },
        "educationalNote": {
          "summary": "Batch Normalization.",
          "detailed": "Normalizes features.",
          "whyItMatters": "Stabilizes learning.",
          "keyTakeaway": "Keeps channels balanced."
        },
        "position": {
          "x": 250,
          "y": 400
        },
        "color": "gray",
        "icon": "activity"
      },
      {
        "id": "conv2d_2_act",
        "type": "activation",
        "name": "conv2d_2_act",
        "inputShape": {
          "dimensions": [
            null,
            null,
            null,
            32
          ],
          "description": "\u00d732"
        },
        "outputShape": {
          "dimensions": [
            null,
            null,
            null,
            32
          ],
          "description": "\u00d732"
        },
        "config": {
          "activation": "relu"
        },
        "parameters": {
          "total": 0,
          "weights": 0,
          "biases": 0,
          "formula": "None",
          "calculationSteps": []
        },
        "educationalNote": {
          "summary": "Applies relu activation.",
          "detailed": "Non-linear mapping.",
          "whyItMatters": "Permits learning complex representations.",
          "keyTakeaway": "Introduces non-linearity."
        },
        "position": {
          "x": 250,
          "y": 450
        },
        "color": "pink",
        "icon": "zap"
      },
      {
        "id": "conv2d_3_conv",
        "type": "conv2d",
        "name": "conv2d_3_conv",
        "inputShape": {
          "dimensions": [
            null,
            null,
            null,
            32
          ],
          "description": "\u00d732"
        },
        "outputShape": {
          "dimensions": [
            null,
            null,
            null,